{
  "$schema": "../../schemas/tool.schema.json",
  "name": "devcontainer-toolio",
  "displayName": "Toolio Dev Container",
  "version": "1.0.0",
  "description": "Development container configuration for the Toolio repository with pre-configured tools and extensions",
  "author": "jsburckhardt",
  "license": "MIT",
  "type": "config",
  "tags": ["devcontainer", "development", "environment", "docker"],
  "platforms": ["vscode-copilot", "generic"],
  "entrypoint": "../../.devcontainer/devcontainer.json",
  "dependencies": [],
  "minAgentVersion": null
}
